id,user_id,customer_no,image,name,review,text,about,no_of_review,rating,date,deleted_at,created_at,updated_at
1,10,CEW-000001,customer-files/joey-ruben.webp,Joey Ruben,I was extremely short on the deadline for my dissertation proposal and I nearly missed it. Until my friend recommended to get dissertation proposal help from Cheap Essay Writing UK. Their writers were so efficient and up to the mark that they delivered the final draft in a few hours and saved me from pleading for extensions. Absolutely Amazing!,Dissertation Proposal,Magni omnis voluptatem et quia. Eaque exercitationem et deserunt dolores vero alias quia. Sunt odit ut modi quia et similique voluptatem. Ea optio id hic in.,391,3.82,24/06/2024,NULL,05/09/2024 15:59,05/09/2024 15:59
2,8,CEW-000002,customer-files/amelia-johnson.webp,Amelia Johnson,"Finally!! I have got the admission to my dream University thanks to Cheap Essay Writing UK for the timely delivery of my admission essay. It seemed impossible for me to get accepted into the university. So, I decided to try my luck by getting professional essay writing services from this website. I am so blown away by the quality they delivered at a very cheap price, I would give them a 10/10.",Admission Essay,Et qui aut vel fugit sint sed. Molestiae non quas est voluptatibus est dolores repellat. Ut iste culpa similique omnis quisquam. Ut possimus fugit quidem quidem et quia.,381,1.7,03/08/2022,NULL,05/09/2024 15:59,05/09/2024 15:59
3,10,CEW-000003,customer-files/isobel-galler.webp,Isobel Galler,"Completing my Law essay along with my part-time job was a challenge but Cheap Essay Writing UK didn’t let me down. At first, I was hesitant, thinking of getting caught, but this website has fulfilled its promise of data privacy and identity protection to its full. For someone who is looking for reliable academic writing service providers, this is your chance of getting one.",Law Essay,Et velit id in est. Nihil qui sunt sit blanditiis.,416,2.83,18/05/2019,NULL,05/09/2024 15:59,05/09/2024 15:59
4,1,CEW-000004,customer-files/orla-oscar.webp,Orla Oscar,"Citations never has been my strength, that’s why I was too concerned about being found guilty of violating plagiarism policies. My deadline was also not allowing me to practice citation rules. So, hiring expert writers from Cheap Essay Writing UK for my psychology dissertation seemed the safest option. As their repeated buyer, I had no concerns over their expertise or work quality, and rightly so, they have never breached my trust in them.",Psychology Dissertation,Quia ea voluptatibus rerum repellendus. Architecto consequatur et harum ratione rerum facere illum. Et minima enim molestias vel corporis nihil.,331,0.78,21/04/2016,NULL,05/09/2024 15:59,05/09/2024 15:59
5,8,CEW-000005,customer-files/joey-ruben.webp,Cian Darragh,"Woohoo!! I just got the news of my scholarship application getting approved. A bunch of thanks to Cheap Essay Writing UK for crafting a perfect scholarship essay. I got rejected multiple times before I consulted them as my last hope. The writer was exceptional and replied to my queries promptly. The plus point was their pricing for those incredible services, they charged me very reasonably. Cheap Essay Writing UK truly means the business.",Scholarship Essay,Debitis dolorem molestiae perspiciatis autem nihil. Repudiandae neque debitis modi nemo deleniti perferendis. Est et quia deleniti tempore. Sed eum nemo iste voluptatem repellendus eos.,309,3.69,11/09/2015,NULL,05/09/2024 15:59,05/09/2024 15:59
6,4,CEW-000006,customer-files/cian-darragh.webp,Noah Arthur,"Outstanding customer support ever, from negotiating for further discounts to contacting them for minor revisions, the support team has been exceptional throughout. Cherry on the top, they delivered high-quality and well-researched chemistry coursework, which earned me nice grades. I would love to work with you guys again.",Chemistry Coursework,Facilis praesentium nesciunt natus quaerat. Deserunt aliquid quisquam voluptas ipsum possimus delectus id. Molestias aperiam dolore ipsum modi delectus. Culpa ea aut qui corporis nostrum nisi accusantium adipisci.,360,1.61,29/10/2013,NULL,05/09/2024 15:59,05/09/2024 15:59
7,7,CEW-000007,customer-files/henry-archie.webp,Henry Archie,"Holy Moley, how can someone deliver a complete engineering dissertation in just one week, that too with original research and high quality? I am amazed by the level of work delivered in a short period. I must say, that the writers at Cheap Essay Writing UK are very skilled and credible. They have given proper attention to details like referencing, layout, and language. I highly appreciate and recommend working with them.",Engineering Dissertation,Iusto nihil eaque dolorem dignissimos deleniti beatae. Et beatae qui non. Nesciunt perspiciatis at illo distinctio eos perspiciatis aut omnis. Impedit culpa praesentium hic qui quod repellendus dolores.,393,2.87,09/02/2011,NULL,05/09/2024 15:59,05/09/2024 15:59
8,7,CEW-000008,customer-files/joey-ruben.webp,Leo Murphy,"Cheap Essay Writing UK has the easiest process of ordering papers from them. I was short on the deadline and wanted to place the order quickly, it proved to be smooth. I trusted my cybersecurity research paper writing task to their impressive writers and they did a great job. Overall, it was a good experience working with them, paper quality, support, and meeting the deadline, everything was spot on.",CyberSecurity Research Paper,,,,22/09/2009,,,
