id,title,user_id,image,slug,content,meta_title,meta_description,meta_keywords,canonical_url,meta_robots
1,"High-Quality Web Development | WordPress, Laravel, CodeIgniter",1,assets/images/logo.jpg,home,Page content for home,"High-Quality Web Development | WordPress, Laravel, CodeIgniter",Best web development and design services in Lahore with our professional team. Let us help you build a successful online platform for your business.,"Web Development, WordPress, Laravel, CodeIgniter",https://umarwaqas.test,"index, follow"
2,"Umar Waqas - Premier Web Development Services | Lahore, Pakistan",1,assets/images/logo.jpg,about,Page content for about,"Umar Waqas - Premier Web Development Services | Lahore, Pakistan","Elevate your online presence with Umar Waqas's web development expertise in WordPress, Laravel, and CodeIgniter.","Web Development, WordPress, Laravel, CodeIgniter",https://umarwaqas.test/about,"index, follow"
3,"Our Services - Web Development, Design, and Consulting",1,assets/images/logo.jpg,services,Page content for services,"Our Services - Web Development, Design, and Consulting","Explore our wide range of services including web development, design, and consulting. We provide top-notch solutions for your digital needs.","Web Development, Design, Consulting",https://umarwaqas.test/services,"index, follow"
4,Our Work - Web Development Portfolio | Umar Waqas,1,assets/images/logo.jpg,work,Page content for work,Our Work - Web Development Portfolio | Umar Waqas,"View our portfolio showcasing web development projects completed by Umar Waqas. See our work in WordPress, Laravel, and other technologies.","Web Development, Portfolio, WordPress, Laravel",https://umarwaqas.test/work,"index, follow"
5,"Web Development Blog | Insights, Tips, and Trends",1,assets/images/logo.jpg,blog,Page content for blog,"Web Development Blog | Insights, Tips, and Trends","Stay informed with Umar Waqas's web development blog. Discover valuable articles, expert tips, and current web development trends.","Web Development, WordPress, Laravel, CodeIgniter, Tips, Trends",https://umarwaqas.test/blog,"index, follow"
6,Contact Us - Get in Touch with Umar Waqas,1,assets/images/logo.jpg,contact,Page content for contact,Contact Us - Get in Touch with Umar Waqas,"Contact Umar Waqas for any web development inquiries, consultations, or collaborations. We are here to assist you with your digital needs.","Contact, Web Development, Inquiry",https://umarwaqas.test/contact,"index, follow"
